quote_id,section,labels,quotation,title,url
1017,abstract,['Accuracy'],"Counterintuitively, the best defense against Grover turns out to be Grover itself, with 92% accuracy, demonstrating the importance of public release of strong generators. ",Defending Against Neural Fake News,http://papers.nips.cc/paper/9106-defending-against-neural-fake-news
1023,introduction,"['Large scale', 'Progress']","To the best of our knowledge, most disinformation online today is manually written (Vargo et al., 2018). However, as progress continues in natural language generation, malicious actors will increasingly be able to controllably generate realistic-looking propaganda at scale. ",Defending Against Neural Fake News,http://papers.nips.cc/paper/9106-defending-against-neural-fake-news
1024,introduction,['Progress'],"Thus, while we are excited about recent progress in text generation (Józefowicz et al., 2016; Radford et al., 2018; 2019), we are also concerned with the inevitability of AI-generated ‘neural’ fake news.",Defending Against Neural Fake News,http://papers.nips.cc/paper/9106-defending-against-neural-fake-news
1025,introduction,"['Large scale', 'Understanding (for researchers)']","With this paper, we seek to understand and respond to neural fake news before it manifests at scale.",Defending Against Neural Fake News,http://papers.nips.cc/paper/9106-defending-against-neural-fake-news
1026,introduction,['Robustness'],"We draw on the field of computer security, which relies on threat modeling: analyzing the space of potential threats and vulnerabilities in a system to develop robust defenses. ",Defending Against Neural Fake News,http://papers.nips.cc/paper/9106-defending-against-neural-fake-news
1027,introduction,['Scientific methodology'],"To scientifically study the risks of neural disinformation, we present a new generative model called Grover.",Defending Against Neural Fake News,http://papers.nips.cc/paper/9106-defending-against-neural-fake-news
1028,introduction,['Efficiency'],"Our model allows for controllable yet effcient generation of an entire news article – not just the body, but also the title, news source, publication date, and author lis",Defending Against Neural Fake News,http://papers.nips.cc/paper/9106-defending-against-neural-fake-news
1029,introduction,"['Controllability (of model owner)', 'Human-like mechanism']","This lets us study an adversary with controllable generations (e.g. Figure 1, an example anti-vaccine article written in the style of the New York Times).",Defending Against Neural Fake News,http://papers.nips.cc/paper/9106-defending-against-neural-fake-news
1030,introduction,['Robustness'],"Humans rate the disinformation generated by Grover as trustworthy, even more so than humanwritten disinformation. Thus, developing robust verification techniques against generators such as Grover is an important research area. ",Defending Against Neural Fake News,http://papers.nips.cc/paper/9106-defending-against-neural-fake-news
1032,introduction,['Accuracy'],"In this setting, the best existing fake news discriminators are, themselves, deep pretrained language models (73% accuracy) (Peters et al., 2018; Radford et al., 2018; 2019; Devlin et al., 2018). However, we find that Grover, when used in a discriminative setting, performs even better at 92% accuracy. ",Defending Against Neural Fake News,http://papers.nips.cc/paper/9106-defending-against-neural-fake-news
1036,introduction,['Understanding (for researchers)'],"We conclude with a sketch of the ethical territory that must be mapped out in order to understand our responsibilities as researchers when studying fake news, and the potential negative implications of releasing models (Hecht et al., 2018; Zellers, 2019; Solaiman et al., 2019). ",Defending Against Neural Fake News,http://papers.nips.cc/paper/9106-defending-against-neural-fake-news
1038,introduction,['Concreteness'],We believe our proposed framework and accompanying models provide a concrete initial proposal for an evolving conversation about ML-based disinformation threats and how they can be countered,Defending Against Neural Fake News,http://papers.nips.cc/paper/9106-defending-against-neural-fake-news
1040,conclusion,['Applies to real world'],Our sketch of what these threats might look like – a controllable language model named Grover – suggests that these threats are real and dangerous. ,Defending Against Neural Fake News,http://papers.nips.cc/paper/9106-defending-against-neural-fake-news
1041,conclusion,['Deferral to humans'],"Grover can rewrite propaganda articles, with humans rating the rewritten versions as more trustworthy. At the same time, there are defenses to these models – notably, in the form of Grover itself. ",Defending Against Neural Fake News,http://papers.nips.cc/paper/9106-defending-against-neural-fake-news
1043,conclusion,['Easy to implement'],"The Era of Neural Disinformation. Though training Grover was challenging, it is easily achievable by real-world adversaries today. ",Defending Against Neural Fake News,http://papers.nips.cc/paper/9106-defending-against-neural-fake-news
1044,conclusion,['Parallelizability / distributed'],Obtaining the data required through Common Crawl cost $10k in AWS credits and can be massively parallelized over many CPUs. ,Defending Against Neural Fake News,http://papers.nips.cc/paper/9106-defending-against-neural-fake-news
1045,conclusion,['Low cost'],"Training Grover-Mega is relatively inexpensive: at a cost of $0.30 per TPU v3 core-hour and two weeks of training, the total cost is $25k. ",Defending Against Neural Fake News,http://papers.nips.cc/paper/9106-defending-against-neural-fake-news
1047,conclusion,['Effectiveness'],"Release of generators is critical. At first, it would seem like keeping models like Grover private would make us safer. However, Grover serves as an e↵ective detector of neural fake news, even when the generator is much larger (Section 5). ",Defending Against Neural Fake News,http://papers.nips.cc/paper/9106-defending-against-neural-fake-news
1049,conclusion,['Progress'],"Future of progress in generation. Models like BERT are strong discriminators for many NLP tasks, but they are not as good at detecting Grover’s generations as left-to-right models like Grover, even after domain adaptation. ",Defending Against Neural Fake News,http://papers.nips.cc/paper/9106-defending-against-neural-fake-news
1050,conclusion,['Progress'],"One hypothesis is that the artifacts shown in Section 6 are most visible to a left-to-right discriminator. This also suggests that recent progress on generating text in any order (Gu et al., 2019; Stern et al., 2019; Ghazvininejad et al., 2019) may lead to models that evade a Grover discriminator. ",Defending Against Neural Fake News,http://papers.nips.cc/paper/9106-defending-against-neural-fake-news
1051,conclusion,['Performance'],"Likewise, models that are trained conditioned on their own predictions might avoid exposure bias, however, these objectives often lead to low performance on language tasks (Caccia et al., 2018). One additional possibility is the use of Adversarial Filtering (Zellers et al., 2018; 2019b) to oversample and then select a subset of generations. ",Defending Against Neural Fake News,http://papers.nips.cc/paper/9106-defending-against-neural-fake-news
1052,conclusion,['Identifying limitations'],"However, we found this didn’t work well for very long sequences (up to 1024 BPE tokens), possibly as these are far from the ‘Goldilocks Zone’ wherein discrimination is hard for machines.",Defending Against Neural Fake News,http://papers.nips.cc/paper/9106-defending-against-neural-fake-news
1058,conclusion,"['Effectiveness', 'Parallelizability / distributed']","Future of progress in discrimination. Our discriminators are e↵ective, but they primarily leverage distributional features rather than evidence. ",Defending Against Neural Fake News,http://papers.nips.cc/paper/9106-defending-against-neural-fake-news
1059,conclusion,['Deferral to humans'],"In contrast, humans assess whether an article is truthful by relying on a model of the world, assessing whether the evidence in the article matches that model. ",Defending Against Neural Fake News,http://papers.nips.cc/paper/9106-defending-against-neural-fake-news
1060,conclusion,"['Progress', 'Scales up']","Future work should investigate integrating knowledge into the discriminator (e.g. for claim verification in FEVER; Thorne et al., 2018). An open question is to scale progress in this task towards entire news articles, and without paired evidence (similar to open-domain QA; Chen et al., 2017).",Defending Against Neural Fake News,http://papers.nips.cc/paper/9106-defending-against-neural-fake-news
1063,conclusion,['Deferral to humans'],"However, humans must still be in the loop due to dangers of flagging real news as machine-generated, and possible unwanted social biases of these models.",Defending Against Neural Fake News,http://papers.nips.cc/paper/9106-defending-against-neural-fake-news
1064,abstract,['Building on classic work'],"We build new test sets for the CIFAR-10 and ImageNet datasets. Both benchmarks have been the focus of intense research for almost a decade, raising the danger of overfitting to excessively re-used test sets.",Do ImageNet Classifiers Generalize to ImageNet?,http://people.csail.mit.edu/ludwigs/papers/imagenet.pdf
1065,abstract,['Generalization'],"By closely following the original dataset creation processes, we test to what extent current classification models generalize to new data.",Do ImageNet Classifiers Generalize to ImageNet?,http://people.csail.mit.edu/ludwigs/papers/imagenet.pdf
1066,abstract,['Accuracy'],We evaluate a broad range of models and find accuracy drops of 3% – 15% on CIFAR-10 and 11% – 14% on ImageNet,Do ImageNet Classifiers Generalize to ImageNet?,http://people.csail.mit.edu/ludwigs/papers/imagenet.pdf
1067,abstract,['Accuracy'],"However, accuracy gains on the original test sets translate to larger gains on the new test sets.",Do ImageNet Classifiers Generalize to ImageNet?,http://people.csail.mit.edu/ludwigs/papers/imagenet.pdf
1068,abstract,"['Generalization', 'Accuracy']","Our results suggest that the accuracy drops are not caused by adaptivity, but by the models’ inability to generalize to slightly “harder” images than those found in the original test sets. ",Do ImageNet Classifiers Generalize to ImageNet?,http://people.csail.mit.edu/ludwigs/papers/imagenet.pdf
1069,introduction,['Generalization'],The overarching goal of machine learning is to produce models that generalize.,Do ImageNet Classifiers Generalize to ImageNet?,http://people.csail.mit.edu/ludwigs/papers/imagenet.pdf
1070,introduction,"['Generalization', 'Performance']",We usually quantify generalization by measuring the performance of a model on a held-out test set.,Do ImageNet Classifiers Generalize to ImageNet?,http://people.csail.mit.edu/ludwigs/papers/imagenet.pdf
1071,introduction,['Performance'],What does good performance on the test set then imply?,Do ImageNet Classifiers Generalize to ImageNet?,http://people.csail.mit.edu/ludwigs/papers/imagenet.pdf
1072,introduction,['Performance'],"At the very least, one would hope that the model also performs well on a new test set assembled from the same data source by following the same data cleaning protocol.",Do ImageNet Classifiers Generalize to ImageNet?,http://people.csail.mit.edu/ludwigs/papers/imagenet.pdf
1073,introduction,['Reproducibility'],"In this paper, we realize this thought experiment by replicating the dataset creation process for two prominent benchmarks, CIFAR-10 and ImageNet",Do ImageNet Classifiers Generalize to ImageNet?,http://people.csail.mit.edu/ludwigs/papers/imagenet.pdf
1074,introduction,['Accuracy'],"In contrast to the ideal outcome, we find that a wide range of classification models fail to reach their original accuracy scores.",Do ImageNet Classifiers Generalize to ImageNet?,http://people.csail.mit.edu/ludwigs/papers/imagenet.pdf
1075,introduction,['Accuracy'],The accuracy drops range from 3% to 15% on CIFAR-10 and 11% to 14% on ImageNet.,Do ImageNet Classifiers Generalize to ImageNet?,http://people.csail.mit.edu/ludwigs/papers/imagenet.pdf
1076,introduction,"['Approximation', 'Accuracy']","On ImageNet, the accuracy loss amounts to approximately five years of progress in a highly active period of machine learning research.",Do ImageNet Classifiers Generalize to ImageNet?,http://people.csail.mit.edu/ludwigs/papers/imagenet.pdf
1078,introduction,['Quantitative evidence (e.g. experiments)'],"However, our experiments show that the relative order of models is almost exactly preserved on our new test sets:",Do ImageNet Classifiers Generalize to ImageNet?,http://people.csail.mit.edu/ludwigs/papers/imagenet.pdf
1079,introduction,['Accuracy'],the models with highest accuracy on the original test sets are still the models with highest accuracy on the new test sets.,Do ImageNet Classifiers Generalize to ImageNet?,http://people.csail.mit.edu/ludwigs/papers/imagenet.pdf
1080,introduction,['Accuracy'],"Moreover, there are no diminishing returns in accuracy",Do ImageNet Classifiers Generalize to ImageNet?,http://people.csail.mit.edu/ludwigs/papers/imagenet.pdf
1081,introduction,"['Accuracy', 'Improvement']","In fact, every percentage point of accuracy improvement on the original test set",Do ImageNet Classifiers Generalize to ImageNet?,http://people.csail.mit.edu/ludwigs/papers/imagenet.pdf
1082,introduction,['Improvement'],test set translates to a larger improvement on our new test sets.,Do ImageNet Classifiers Generalize to ImageNet?,http://people.csail.mit.edu/ludwigs/papers/imagenet.pdf
1083,introduction,['Accuracy'],"So although later models could have been adapted more to the test set, they see smaller drops in accuracy.",Do ImageNet Classifiers Generalize to ImageNet?,http://people.csail.mit.edu/ludwigs/papers/imagenet.pdf
1084,introduction,"['Quantitative evidence (e.g. experiments)', 'Effectiveness', 'Improvement']",These results provide evidence that exhaustive test set evaluations are an effective way to improve image classification models.,Do ImageNet Classifiers Generalize to ImageNet?,http://people.csail.mit.edu/ludwigs/papers/imagenet.pdf
1085,introduction,['Accuracy'],Adaptivity is therefore an unlikely explanation for the accuracy drops.,Do ImageNet Classifiers Generalize to ImageNet?,http://people.csail.mit.edu/ludwigs/papers/imagenet.pdf
1087,introduction,"['Approximation', 'Exactness', 'Accuracy']",We demonstrate that it is possible to recover the original ImageNet accuracies almost exactly if we only include the easiest images from our candidate pool.,Do ImageNet Classifiers Generalize to ImageNet?,http://people.csail.mit.edu/ludwigs/papers/imagenet.pdf
1088,introduction,['Accuracy'],This suggests that the accuracy scores of even the best image classifiers are still highly sensitive to minutiae of the data cleaning process. ,Do ImageNet Classifiers Generalize to ImageNet?,http://people.csail.mit.edu/ludwigs/papers/imagenet.pdf
1089,introduction,"['Generalization', 'Quantitative evidence (e.g. experiments)', 'Reproducibility']","This brittleness puts claims about human-level performance into context [20, 31, 48]. It also shows that current classifiers still do not generalize reliably even in the benign environment of a carefully controlled reproducibility experiment.",Do ImageNet Classifiers Generalize to ImageNet?,http://people.csail.mit.edu/ludwigs/papers/imagenet.pdf
1090,introduction,['Quantitative evidence (e.g. experiments)'],"Figure 1 shows the main result of our experiment. Before we describe our methodology in Section 3, the next section provides relevant background. To enable future research, we release both our new test sets and the corresponding code.1
",Do ImageNet Classifiers Generalize to ImageNet?,http://people.csail.mit.edu/ludwigs/papers/imagenet.pdf
1091,introduction,['Reproducibility'],Ideal reproducibility,Do ImageNet Classifiers Generalize to ImageNet?,http://people.csail.mit.edu/ludwigs/papers/imagenet.pdf
1092,introduction,['Accuracy'],Model accuracy,Do ImageNet Classifiers Generalize to ImageNet?,http://people.csail.mit.edu/ludwigs/papers/imagenet.pdf
1093,introduction,['Accuracy'],Figure 1: Model accuracy on the original test sets vs. our new test sets. Each data point corresponds to one model in our testbed (shown with 95% Clopper-Pearson confidence intervals). The plots reveal two main phenomena:,Do ImageNet Classifiers Generalize to ImageNet?,http://people.csail.mit.edu/ludwigs/papers/imagenet.pdf
1094,introduction,['Accuracy'],(i) There is a significant drop in accuracy from the original to the new test sets,Do ImageNet Classifiers Generalize to ImageNet?,http://people.csail.mit.edu/ludwigs/papers/imagenet.pdf
1095,introduction,['Accuracy'],(ii) The model accuracies closely follow a linear function with slope greater than 1 (1:7 for CIFAR-10 and 1:1 for ImageNet,Do ImageNet Classifiers Generalize to ImageNet?,http://people.csail.mit.edu/ludwigs/papers/imagenet.pdf
1096,introduction,['Progress'],This means that every percentage point of progress on the original test set translates into more than one percentage point on the new test set.,Do ImageNet Classifiers Generalize to ImageNet?,http://people.csail.mit.edu/ludwigs/papers/imagenet.pdf
1100,conclusion,['Performance'],"In order to use machine learning in these areas responsibly, it is important that we can both train models with sufficient generalization abilities, and also reliably measure their performance.",Do ImageNet Classifiers Generalize to ImageNet?,http://people.csail.mit.edu/ludwigs/papers/imagenet.pdf
1102,conclusion,"['Quantitative evidence (e.g. experiments)', 'Promising']","Our experiments are only one step in addressing this reliability challenge. There are multiple promising avenues for future work:
",Do ImageNet Classifiers Generalize to ImageNet?,http://people.csail.mit.edu/ludwigs/papers/imagenet.pdf
1103,conclusion,"['Quantitative evidence (e.g. experiments)', 'Understanding (for researchers)']","Understanding Adaptive Overfitting. In contrast to conventional wisdom, our experiments show that there are no diminishing returns associated with test set re-use on CIFAR-10 and ImageNet.",Do ImageNet Classifiers Generalize to ImageNet?,http://people.csail.mit.edu/ludwigs/papers/imagenet.pdf
1104,conclusion,['Understanding (for researchers)'],A more nuanced understanding of this phenomenon will require studying whether other machine learning problems are also resilient to adaptive overfitting.,Do ImageNet Classifiers Generalize to ImageNet?,http://people.csail.mit.edu/ludwigs/papers/imagenet.pdf
1105,conclusion,"['Quantitative evidence (e.g. experiments)', 'Reproducibility']","For instance, one direction would be to conduct similar reproducibility experiments on tasks in natural language processing, or to analyze data from competition platforms such as Kaggle and CodaLab.7
",Do ImageNet Classifiers Generalize to ImageNet?,http://people.csail.mit.edu/ludwigs/papers/imagenet.pdf
1106,conclusion,"['Quantitative evidence (e.g. experiments)', 'Performance', 'Learning from humans']",Characterizing the Distribution Gap. Why do the classification models in our testbed perform worse on the new test sets? The selection frequency experiments in Section 4 suggest that images selected less frequently by the MTurk workers are harder for the models.,Do ImageNet Classifiers Generalize to ImageNet?,http://people.csail.mit.edu/ludwigs/papers/imagenet.pdf
1108,conclusion,['Robustness'],Learning More Robust Models.,Do ImageNet Classifiers Generalize to ImageNet?,http://people.csail.mit.edu/ludwigs/papers/imagenet.pdf
1109,conclusion,['Robustness'],An overarching goal is to make classification models more robust to small variations in the data.,Do ImageNet Classifiers Generalize to ImageNet?,http://people.csail.mit.edu/ludwigs/papers/imagenet.pdf
1110,conclusion,['Accuracy'],"If the change from the original to our new test sets can be characterized accurately, ",Do ImageNet Classifiers Generalize to ImageNet?,http://people.csail.mit.edu/ludwigs/papers/imagenet.pdf
1111,conclusion,"['Robustness', 'Accuracy']",techniques such as data augmentation or robust optimization may be able to close some of the accuracy gap.,Do ImageNet Classifiers Generalize to ImageNet?,http://people.csail.mit.edu/ludwigs/papers/imagenet.pdf
1113,conclusion,['Accuracy'],Measuring Human Accuracy. One interesting question is whether our new test sets are also harder for humans,Do ImageNet Classifiers Generalize to ImageNet?,http://people.csail.mit.edu/ludwigs/papers/imagenet.pdf
1114,conclusion,"['Quantitative evidence (e.g. experiments)', 'Accuracy']","As a first step in this direction, our human accuracy experiment on CIFAR10 (see Appendix B.2.5) shows that average human performance is not affected significantly by the distribution shift between the original and new images that are most difficult for the models.",Do ImageNet Classifiers Generalize to ImageNet?,http://people.csail.mit.edu/ludwigs/papers/imagenet.pdf
1116,conclusion,"['Quantitative evidence (e.g. experiments)', 'Accuracy', 'Building on classic work', 'Understanding (for researchers)']",But a more comprehensive understanding of the human baseline will require additional human accuracy experiments on both CIFAR-10 and ImageNet. ,Do ImageNet Classifiers Generalize to ImageNet?,http://people.csail.mit.edu/ludwigs/papers/imagenet.pdf
1117,conclusion,['Performance'],Building Further Test Sets. The dominant paradigm in machine learning is to evaluate the performance of a classification model on a single test set per benchmark,Do ImageNet Classifiers Generalize to ImageNet?,http://people.csail.mit.edu/ludwigs/papers/imagenet.pdf
1118,conclusion,['Quantitative evidence (e.g. experiments)'],Our results suggest that this is not comprehensive enough to characterize the reliability of current models.,Do ImageNet Classifiers Generalize to ImageNet?,http://people.csail.mit.edu/ludwigs/papers/imagenet.pdf
1119,conclusion,"['Generalization', 'Accuracy']","To understand their generalization abilities more accurately, new test data from various sources may be needed.",Do ImageNet Classifiers Generalize to ImageNet?,http://people.csail.mit.edu/ludwigs/papers/imagenet.pdf
1120,conclusion,['Accuracy'],One intriguing question here is whether accuracy on other test sets will also follow,Do ImageNet Classifiers Generalize to ImageNet?,http://people.csail.mit.edu/ludwigs/papers/imagenet.pdf
1121,conclusion,['Accuracy'],linear function of the original test accuracy.,Do ImageNet Classifiers Generalize to ImageNet?,http://people.csail.mit.edu/ludwigs/papers/imagenet.pdf
1123,conclusion,['Reproducibility'],Code release. It is hard to fully document the dataset creation process in a paper because it involves a long list of design choices. Hence it would be beneficial for reproducibility efforts if future dataset papers released not only the data but also all code used to create the datasets.,Do ImageNet Classifiers Generalize to ImageNet?,http://people.csail.mit.edu/ludwigs/papers/imagenet.pdf
1126,conclusion,"['Qualitative evidence (e.g. examples)', 'Accuracy']","“Super hold-out”. Having access to data from the original CIFAR-10 and ImageNet data collection could have clarified the cause of the accuracy drops in our experiments. By keeping an additional test set hidden for multiple years, future benchmarks could explicitly test for adaptive overfitting after a certain time period.",Do ImageNet Classifiers Generalize to ImageNet?,http://people.csail.mit.edu/ludwigs/papers/imagenet.pdf
1129,conclusion,['Performance'],"Moreover, the large number of classes causes difficulties when characterizing human performance.",Do ImageNet Classifiers Generalize to ImageNet?,http://people.csail.mit.edu/ludwigs/papers/imagenet.pdf
1134,conclusion,"['Accuracy', 'State-of-the-art']","Both datasets were assembled in the late 2000s for an accuracy regime that is very different from the state-of-the-art now. Over the past decade, especially ImageNet has successfully guided the field to increasingly better models, thereby clearly demonstrating the immense value of
this dataset. ",Do ImageNet Classifiers Generalize to ImageNet?,http://people.csail.mit.edu/ludwigs/papers/imagenet.pdf
1135,conclusion,['Accuracy'],"But as models have increased in accuracy and our reliability expectations have grown accordingly, it is now time to revisit how we create and utilize datasets in machine learning.",Do ImageNet Classifiers Generalize to ImageNet?,http://people.csail.mit.edu/ludwigs/papers/imagenet.pdf
1136,abstract,"['Large scale', 'Promising', 'Data efficiency']","The promise of unsupervised learning methods lies in their potential to use vast amounts of unlabeled data to learn complex, highly nonlinear models with millions of free parameters. ",Large-scale deep unsupervised learning using graphics processors,https://dl.acm.org/doi/abs/10.1145/1553374.1553486
1137,abstract,"['Building on recent work', 'Used in practice/Popular']","We consider two well-known unsupervised learning models, deep belief networks (DBNs) and sparse coding, that have recently been applied to a flurry of machine learning applications (Hinton & Salakhutdinov, 2006; Raina et al., 2007). ",Large-scale deep unsupervised learning using graphics processors,https://dl.acm.org/doi/abs/10.1145/1553374.1553486
1138,abstract,['Large scale'],"Unfortunately, current learning algorithms for both models are too slow for large-scale applications, forcing researchers to focus on smaller-scale models, or to use fewer training examples. ",Large-scale deep unsupervised learning using graphics processors,https://dl.acm.org/doi/abs/10.1145/1553374.1553486
