quote_id,section,labels,quotation,title,url
2780,introduction,"['Generalization', 'Scientific methodology']",There are a number of methods in the literature to use Rademacher complexities to obtain either generalization bounds or margin bounds. ,"On the Complexity of Linear Prediction: Risk Bounds, Margin Bounds, and Regularization",https://papers.nips.cc/paper/2008/file/5b69b9cb83065d403869739ae7f0995e-Paper.pdf
2781,introduction,"['Generalization', 'Building on classic work']",Bartlett and Mendelson [2002] provide a generalization bound for Lipschitz loss functions. ,"On the Complexity of Linear Prediction: Risk Bounds, Margin Bounds, and Regularization",https://papers.nips.cc/paper/2008/file/5b69b9cb83065d403869739ae7f0995e-Paper.pdf
2782,introduction,['Building on classic work'],"For binary prediction, the results in Koltchinskii and Panchenko [2002] provide means to obtain margin bounds through Rademacher complexities","On the Complexity of Linear Prediction: Risk Bounds, Margin Bounds, and Regularization",https://papers.nips.cc/paper/2008/file/5b69b9cb83065d403869739ae7f0995e-Paper.pdf
2784,introduction,"['Simplicity', 'Generalization', 'Theoretical guarantees', 'Generality', 'Unifying ideas or integrating components']","These bounds provide simplified proofs of a number of corollaries: generalization bounds for the regularization algorithm in Equation 2 (including settings where the weight vectors are constrained by either L2 or L1 constraints), margin bounds (including L2 and L1 margins, and, more generally, for Lp margins), a proof of the PAC-Bayes theorem, and L2 covering numbers (with Lp norm constraints and relative entropy constraints). ","On the Complexity of Linear Prediction: Risk Bounds, Margin Bounds, and Regularization",https://papers.nips.cc/paper/2008/file/5b69b9cb83065d403869739ae7f0995e-Paper.pdf
2785,introduction,"['Theoretical guarantees', 'Unifying ideas or integrating components']",Our bounds are often tighter than previous results and our proofs are all under this more unified methodology.,"On the Complexity of Linear Prediction: Risk Bounds, Margin Bounds, and Regularization",https://papers.nips.cc/paper/2008/file/5b69b9cb83065d403869739ae7f0995e-Paper.pdf
2786,introduction,"['Theoretical guarantees', 'Generality', 'Building on classic work']",Our proof techniques — reminiscent of those techniques for deriving regret bounds for online learning algorithms — are rooted in convex duality (following Meir and Zhang [2003]) and use a more general notion of strong convexity (as in Shalev-Shwartz and Singer [2006]). ,"On the Complexity of Linear Prediction: Risk Bounds, Margin Bounds, and Regularization",https://papers.nips.cc/paper/2008/file/5b69b9cb83065d403869739ae7f0995e-Paper.pdf
2790,related work,['Building on classic work'],"Perhaps the most extensively studied are margin bounds for the 0-1 loss. For L2-margins (relevant for SVM’s, perceptron based algorithms, etc.), the sharpest bounds are those provided by Bartlett and Mendelson [2002] (using Rademacher complexities) and Langford and Shawe-Taylor [2003], McAllester [2003] (using the PAC-Bayes theorem). ","On the Complexity of Linear Prediction: Risk Bounds, Margin Bounds, and Regularization",https://papers.nips.cc/paper/2008/file/5b69b9cb83065d403869739ae7f0995e-Paper.pdf
2791,related work,"['Scientific methodology', 'Building on classic work']","For L1-margins (relevant for Boosting, winnow, etc), bounds are provided by Schapire et al. [1998] (using a self-contained analysis) and Langford et al. [2001] (using PAC-Bayes, with a different analysis). Another active line of work is on sparse methods — particularly methods which impose sparsity via L1 regularization (in lieu of the non-convex L0 norm). ","On the Complexity of Linear Prediction: Risk Bounds, Margin Bounds, and Regularization",https://papers.nips.cc/paper/2008/file/5b69b9cb83065d403869739ae7f0995e-Paper.pdf
2792,related work,"['Generalization', 'Building on classic work']","For L1 regularization, Ng [2004] provides generalization bounds for this case, which follow from the covering number bounds of Zhang [2002]. However, these bounds are only stated as polynomial in the relevant quantities (dependencies are not provided).","On the Complexity of Linear Prediction: Risk Bounds, Margin Bounds, and Regularization",https://papers.nips.cc/paper/2008/file/5b69b9cb83065d403869739ae7f0995e-Paper.pdf
2793,related work,"['Generalization', 'Building on classic work', 'Unifying ideas or integrating components']","Previous to this work, the most unified framework for providing generalization bounds for linear prediction stem from the covering number bounds in Zhang [2002]. ","On the Complexity of Linear Prediction: Risk Bounds, Margin Bounds, and Regularization",https://papers.nips.cc/paper/2008/file/5b69b9cb83065d403869739ae7f0995e-Paper.pdf
2794,related work,"['Generalization', 'Building on classic work']","Using these covering number bounds, Zhang [2002] derives margin bounds in a variety of cases. However, providing sharp generalization bounds for problems with L1 regularization (or L1 constraints in the dual) requires more delicate arguments. ","On the Complexity of Linear Prediction: Risk Bounds, Margin Bounds, and Regularization",https://papers.nips.cc/paper/2008/file/5b69b9cb83065d403869739ae7f0995e-Paper.pdf
2795,related work,['Building on classic work'],"As mentioned, Ng [2004] provides bounds for this case, but the techniques used by Ng [2004] would result in rather loose dependencies (the dependence on the sample size n would be n −1/4 rather than n −1/2 ). We discuss this later in Section 4.","On the Complexity of Linear Prediction: Risk Bounds, Margin Bounds, and Regularization",https://papers.nips.cc/paper/2008/file/5b69b9cb83065d403869739ae7f0995e-Paper.pdf
2798,discussion,['Performance'],"The algorithm we consider performs the update, wt+1 = ∇F −1 (∇F(wt) − η∇wℓ(hwt, xti, yt))","On the Complexity of Linear Prediction: Risk Bounds, Margin Bounds, and Regularization",https://papers.nips.cc/paper/2008/file/5b69b9cb83065d403869739ae7f0995e-Paper.pdf
2799,discussion,['Building on classic work'],"This algorithm captures both gradient updates, multiplicative updates, and updates based on the Lp norms, through appropriate choices of F. See Shalev-Shwartz [2007] for discussion.","On the Complexity of Linear Prediction: Risk Bounds, Margin Bounds, and Regularization",https://papers.nips.cc/paper/2008/file/5b69b9cb83065d403869739ae7f0995e-Paper.pdf
2800,discussion,['Formal description/analysis'],"For the algorithm given by the above update, the following theorem is a bound on the cumulative regret. ","On the Complexity of Linear Prediction: Risk Bounds, Margin Bounds, and Regularization",https://papers.nips.cc/paper/2008/file/5b69b9cb83065d403869739ae7f0995e-Paper.pdf
2801,discussion,['Building on classic work'],"It is a corollary of Theorem 1 in Shalev-Shwartz and Singer [2006] (and also of Corollary 1 in Shalev-Shwartz [2007]), applied to our linear case. ","On the Complexity of Linear Prediction: Risk Bounds, Margin Bounds, and Regularization",https://papers.nips.cc/paper/2008/file/5b69b9cb83065d403869739ae7f0995e-Paper.pdf
2802,discussion,['Building on classic work'],"Corollary 10. (Shalev-Shwartz and Singer [2006]) Let S be a closed convex set and let F : S → R be σ-strongly convex w.r.t. k · k∗. Further, let X = {x : kxk ≤ X} and W = {w ∈ S : F(w) ≤ W2∗ }. ","On the Complexity of Linear Prediction: Risk Bounds, Margin Bounds, and Regularization",https://papers.nips.cc/paper/2008/file/5b69b9cb83065d403869739ae7f0995e-Paper.pdf
2803,discussion,['Preciseness'],"Then for the update given by Equation 9 if we start with w1 = argmin F(w), we have that for all sequences {(xt, yt)} n t=1, Xn t=1(hwt, xti, yt) − argmin w∈W Xn t=1 ℓ(hw, xti, yt) ≤ LℓXW∗ r 2n σ","On the Complexity of Linear Prediction: Risk Bounds, Margin Bounds, and Regularization",https://papers.nips.cc/paper/2008/file/5b69b9cb83065d403869739ae7f0995e-Paper.pdf
2804,discussion,['Preciseness'],"For completeness, we provide a direct proof in the Appendix. Interestingly, the regret above is precisely our complexity bounds (when Lℓ = 1). Also, our risk bounds are a factor of 2 worse, essentially due to the symmetrization step used in proving Theorem 1.","On the Complexity of Linear Prediction: Risk Bounds, Margin Bounds, and Regularization",https://papers.nips.cc/paper/2008/file/5b69b9cb83065d403869739ae7f0995e-Paper.pdf
2806,Abstract,['Efficiency'],Recent studies have demonstrated the efficiency of generative pretraining for En- glish natural language understanding.,Cross-lingual Language Model Pretraining,http://papers.nips.cc/paper/8928-cross-lingual-language-model-pretraining
2807,Abstract,['Effectiveness'],"In this work, we extend this approach to multiple languages and show the effectiveness of cross-lingual pretraining.",Cross-lingual Language Model Pretraining,http://papers.nips.cc/paper/8928-cross-lingual-language-model-pretraining
2809,Abstract,['State-of-the-art'],"We obtain state-of- the-art results on cross-lingual classification, unsupervised and supervised machine translation.",Cross-lingual Language Model Pretraining,http://papers.nips.cc/paper/8928-cross-lingual-language-model-pretraining
2810,Abstract,"['Accuracy', 'State-of-the-art']","On XNLI, our approach pushes the state of the art by an absolute gain of 4.9% accuracy.",Cross-lingual Language Model Pretraining,http://papers.nips.cc/paper/8928-cross-lingual-language-model-pretraining
2811,Abstract,"['Quantitative evidence (e.g. experiments)', 'State-of-the-art', 'Improvement']","On unsupervised machine translation, we obtain 34.3 BLEU on WMT’ 16 German-English, improving the previous state of the art by more than 9 BLEU.",Cross-lingual Language Model Pretraining,http://papers.nips.cc/paper/8928-cross-lingual-language-model-pretraining
2812,Abstract,"['Quantitative evidence (e.g. experiments)', 'Performance', 'State-of-the-art']","On supervised machine translation, we obtain a new state of the art of 38.5 BLEU on WMT’ 16 Romanian-English, outperforming the previous best approach by more than 4 BLEU.",Cross-lingual Language Model Pretraining,http://papers.nips.cc/paper/8928-cross-lingual-language-model-pretraining
2813,Abstract,['Facilitating use (e.g. sharing code)'],Our code and pretrained models are publicly available'.,Cross-lingual Language Model Pretraining,http://papers.nips.cc/paper/8928-cross-lingual-language-model-pretraining
2815,Intro,"['Quantitative evidence (e.g. experiments)', 'Improvement']","Generative pretraining of sentence encoders [30, 20, 14] has led to strong improvements on numerous natural language understanding benchmarks [40].",Cross-lingual Language Model Pretraining,http://papers.nips.cc/paper/8928-cross-lingual-language-model-pretraining
2818,Intro,['Not socially biased'],Recent developments in learning and evaluating cross-lingual sentence representations in many languages [12] aim at mitigating the English-centric bias and suggest that it is possible to build universal cross-lingual encoders that can encode any sentence into a shared embedding space.,Cross-lingual Language Model Pretraining,http://papers.nips.cc/paper/8928-cross-lingual-language-model-pretraining
2819,Intro,"['Quantitative evidence (e.g. experiments)', 'Effectiveness']","In this work, we demonstrate the effectiveness of cross-lingual language model pretraining on multiple cross-lingual understanding (XLU) benchmarks.",Cross-lingual Language Model Pretraining,http://papers.nips.cc/paper/8928-cross-lingual-language-model-pretraining
2820,Intro,['Preciseness'],"Precisely, we make the following contributions:",Cross-lingual Language Model Pretraining,http://papers.nips.cc/paper/8928-cross-lingual-language-model-pretraining
2822,Intro,['Novelty'],We introduce a new unsupervised method for learning cross-lingual representations using cross-lingual language modeling and investigate two monolingual pretraining objectives.,Cross-lingual Language Model Pretraining,http://papers.nips.cc/paper/8928-cross-lingual-language-model-pretraining
2824,Intro,"['Novelty', 'Improvement']",We introduce a new supervised learning objective that improves cross-lingual pretraining when parallel data is available.,Cross-lingual Language Model Pretraining,http://papers.nips.cc/paper/8928-cross-lingual-language-model-pretraining
2826,Intro,"['Performance', 'State-of-the-art']","We significantly outperform the previous state of the art on cross-lingual classification, unsupervised machine translation and supervised machine translation.",Cross-lingual Language Model Pretraining,http://papers.nips.cc/paper/8928-cross-lingual-language-model-pretraining
2828,Intro,"['Improvement', 'Requires few resources']",We show that cross-lingual language models can provide significant improvements on the perplexity of low-resource languages.,Cross-lingual Language Model Pretraining,http://papers.nips.cc/paper/8928-cross-lingual-language-model-pretraining
2830,Intro,['Facilitating use (e.g. sharing code)'],We make our code and pretrained models publicly available'.,Cross-lingual Language Model Pretraining,http://papers.nips.cc/paper/8928-cross-lingual-language-model-pretraining
2832,Conclusion,['Novelty'],"In this work, we show for the first time the strong impact of cross-lingual language model (XLM) pretraining.",Cross-lingual Language Model Pretraining,http://papers.nips.cc/paper/8928-cross-lingual-language-model-pretraining
2835,Conclusion,['Effectiveness'],"On unsupervised machine translation, we show that MLM pretraining is extremely effective.",Cross-lingual Language Model Pretraining,http://papers.nips.cc/paper/8928-cross-lingual-language-model-pretraining
2836,Conclusion,"['Quantitative evidence (e.g. experiments)', 'Performance', 'State-of-the-art']","We reach a new state of the art of 34.3 BLEU on WMT’ 16 German-English, outperforming the previous best approach by more than 9 BLEU.",Cross-lingual Language Model Pretraining,http://papers.nips.cc/paper/8928-cross-lingual-language-model-pretraining
2837,Conclusion,['Improvement'],"Similarly, we obtain strong improvements on supervised machine translation.",Cross-lingual Language Model Pretraining,http://papers.nips.cc/paper/8928-cross-lingual-language-model-pretraining
2838,Conclusion,"['Quantitative evidence (e.g. experiments)', 'State-of-the-art', 'Improvement']","We reach a new state of the art on WMT’ 16 Romanian-English of 38.5 BLEU, which corresponds to an improvement of more than 4 BLEU points.",Cross-lingual Language Model Pretraining,http://papers.nips.cc/paper/8928-cross-lingual-language-model-pretraining
2839,Conclusion,"['Quantitative evidence (e.g. experiments)', 'Data efficiency', 'Improvement', 'Requires few resources']","We also demonstrate that XLMs can be used to improve the perplexity of a Nepali language model, and that it provides unsupervised cross-lingual word embeddings.",Cross-lingual Language Model Pretraining,http://papers.nips.cc/paper/8928-cross-lingual-language-model-pretraining
2840,Conclusion,"['Performance', 'Accuracy', 'State-of-the-art', 'Data efficiency']","Without using a single parallel sentence, our MLM model fine-tuned on XNLI already outperforms the previous supervised state of the art by 1.3% accuracy on average.",Cross-lingual Language Model Pretraining,http://papers.nips.cc/paper/8928-cross-lingual-language-model-pretraining
2841,Conclusion,['Improvement'],Our translation language model objective (TLM) leverages parallel data to improve further the alignment of sentence representations.,Cross-lingual Language Model Pretraining,http://papers.nips.cc/paper/8928-cross-lingual-language-model-pretraining
2842,Conclusion,"['Quantitative evidence (e.g. experiments)', 'Accuracy', 'State-of-the-art']","When used together with MLM, we show that this supervised approach beats the previous state of the art on XNLI by 4.9% accuracy on average.",Cross-lingual Language Model Pretraining,http://papers.nips.cc/paper/8928-cross-lingual-language-model-pretraining
2843,Conclusion,['Facilitating use (e.g. sharing code)'],Our code and pretrained models are publicly available.,Cross-lingual Language Model Pretraining,http://papers.nips.cc/paper/8928-cross-lingual-language-model-pretraining
2848,abstract,"['Quantitative evidence (e.g. experiments)', 'Exactness']","While these theoretical results are only exact in theinfinite width limit, we nevertheless find excellent empirical agreement betweenthe predictions of the original network and those of the linearized version evenfor finite practically-sized networks. ",Wide Neural Networks of Any Depth Evolve asLinear Models Under Gradient Descent,http://papers.nips.cc/paper/9063-wide-neural-networks-of-any-depth-evolve-as-linear-models-under-gradient-descent.pdf
2849,abstract,['Robustness'],"This agreement is robust across differentarchitectures, optimization methods, and loss functions",Wide Neural Networks of Any Depth Evolve asLinear Models Under Gradient Descent,http://papers.nips.cc/paper/9063-wide-neural-networks-of-any-depth-evolve-as-linear-models-under-gradient-descent.pdf
2850,intro,"['Generalization', 'Performance']","Machine learning models based on deep neural networks have achieved unprecedented performanceacross a wide range of tasks [1,2,3]. ",Wide Neural Networks of Any Depth Evolve asLinear Models Under Gradient Descent,http://papers.nips.cc/paper/9063-wide-neural-networks-of-any-depth-evolve-as-linear-models-under-gradient-descent.pdf
2852,intro,['Easy'],"Moreover, characterizing the gradient-based training dynamics of these models is challenging owing to the typically high-dimensional non-convex loss surfaces governing the optimization.",Wide Neural Networks of Any Depth Evolve asLinear Models Under Gradient Descent,http://papers.nips.cc/paper/9063-wide-neural-networks-of-any-depth-evolve-as-linear-models-under-gradient-descent.pdf
2853,intro,"['Formal description/analysis', 'Scientific methodology', 'Understanding (for researchers)']","As is common in the physical sciences, investigating theextreme limits of such systems can often shed light on these hard problems",Wide Neural Networks of Any Depth Evolve asLinear Models Under Gradient Descent,http://papers.nips.cc/paper/9063-wide-neural-networks-of-any-depth-evolve-as-linear-models-under-gradient-descent.pdf
2856,intro,"['Simplicity', 'Generalization', 'Formal description/analysis', 'Practical.1']","Aside fromits theoretical simplicity, the infinite-width limit is also of practical interest as wider networks havebeen found to generalize better",Wide Neural Networks of Any Depth Evolve asLinear Models Under Gradient Descent,http://papers.nips.cc/paper/9063-wide-neural-networks-of-any-depth-evolve-as-linear-models-under-gradient-descent.pdf
2859,intro,"['Quantitative evidence (e.g. experiments)', 'Exactness']","While the linearization is only exact in the infinite width limit, we nevertheless find excellent agreement between the predictions of the original network and those of the linearized version even for finite width configurations.",Wide Neural Networks of Any Depth Evolve asLinear Models Under Gradient Descent,http://papers.nips.cc/paper/9063-wide-neural-networks-of-any-depth-evolve-as-linear-models-under-gradient-descent.pdf
2860,intro,['Generalization'],"The agreement persists across different architectures, optimization methods, and loss functions.",Wide Neural Networks of Any Depth Evolve asLinear Models Under Gradient Descent,http://papers.nips.cc/paper/9063-wide-neural-networks-of-any-depth-evolve-as-linear-models-under-gradient-descent.pdf
2861,intro,"['Formal description/analysis', 'Unifying ideas or integrating components']","For squared loss, the exact learning dynamics admit a closed-form solution that allows us to charac- terize the evolution of the predictive distribution in terms of a GP.",Wide Neural Networks of Any Depth Evolve asLinear Models Under Gradient Descent,http://papers.nips.cc/paper/9063-wide-neural-networks-of-any-depth-evolve-as-linear-models-under-gradient-descent.pdf
2863,intro,"['Quantitative evidence (e.g. experiments)', 'Accuracy']",Our empirical simulations confirm that the result accurately models the variation in predictions...,Wide Neural Networks of Any Depth Evolve asLinear Models Under Gradient Descent,http://papers.nips.cc/paper/9063-wide-neural-networks-of-any-depth-evolve-as-linear-models-under-gradient-descent.pdf
2864,intro,['Unifying ideas or integrating components'],"- Parameter space dynamics: We show that wide network training dynamics in parameter space are equivalent to the training dynamics of a model which is affine in the collection of all network parameters, the weights and biases.",Wide Neural Networks of Any Depth Evolve asLinear Models Under Gradient Descent,http://papers.nips.cc/paper/9063-wide-neural-networks-of-any-depth-evolve-as-linear-models-under-gradient-descent.pdf
2865,intro,['Generalization'],This result holds regardless of the choice of loss function.,Wide Neural Networks of Any Depth Evolve asLinear Models Under Gradient Descent,http://papers.nips.cc/paper/9063-wide-neural-networks-of-any-depth-evolve-as-linear-models-under-gradient-descent.pdf
2867,intro,['Formal description/analysis'],"- Sufficient conditions for linearization: We formally prove that there exists a threshold learning rate Yeritical (see Theorem 2.1), such that gradient descent training trajectories with learning rate smaller than 7eritical Stay in an O (n-V ?\-neighborhood of the trajectory of the linearized network when n, the width of the hidden layers, is sufficiently large.
",Wide Neural Networks of Any Depth Evolve asLinear Models Under Gradient Descent,http://papers.nips.cc/paper/9063-wide-neural-networks-of-any-depth-evolve-as-linear-models-under-gradient-descent.pdf
2868,intro,"['Formal description/analysis', 'Building on recent work', 'Unifying ideas or integrating components']","- Output distribution dynamics: We formally show that the predictions of a neural network throughout gradient descent training are described by a GP as the width goes to infinity (see Theorem 2.2), extending results from Jacot et al.[13].",Wide Neural Networks of Any Depth Evolve asLinear Models Under Gradient Descent,http://papers.nips.cc/paper/9063-wide-neural-networks-of-any-depth-evolve-as-linear-models-under-gradient-descent.pdf
2869,intro,['Formal description/analysis'],We further derive explicit time-dependent expressions for the evolution of this GP during training.,Wide Neural Networks of Any Depth Evolve asLinear Models Under Gradient Descent,http://papers.nips.cc/paper/9063-wide-neural-networks-of-any-depth-evolve-as-linear-models-under-gradient-descent.pdf
2870,intro,['Novelty'],"Finally, we provide a novel interpretationof the result.",Wide Neural Networks of Any Depth Evolve asLinear Models Under Gradient Descent,http://papers.nips.cc/paper/9063-wide-neural-networks-of-any-depth-evolve-as-linear-models-under-gradient-descent.pdf
2871,intro,"['Quantitative evidence (e.g. experiments)', 'Unifying ideas or integrating components', 'Understanding (for researchers)']","In particular, it offers a quantitative understanding of the mechanism by which gradient descent differs from Bayesian posterior sampling of the parameters: while both methods generate draws from a GP, gradient descent does not generate samples from the posterior of any probabilistic model.",Wide Neural Networks of Any Depth Evolve asLinear Models Under Gradient Descent,http://papers.nips.cc/paper/9063-wide-neural-networks-of-any-depth-evolve-as-linear-models-under-gradient-descent.pdf
2872,intro,"['Generalization', 'Quantitative evidence (e.g. experiments)', 'Large scale', 'Accuracy', 'Understanding (for researchers)', 'Practical.1']","- Large scale experimental support: We empirically investigate the applicability of the theory in the finite-width setting and find that it gives an accurate characterization of both learning dynamics and posterior function distributions across a variety of conditions, including some practical network architectures such as the wide residual network [14].",Wide Neural Networks of Any Depth Evolve asLinear Models Under Gradient Descent,http://papers.nips.cc/paper/9063-wide-neural-networks-of-any-depth-evolve-as-linear-models-under-gradient-descent.pdf
2874,intro,['Formal description/analysis'],- Analytic ReLU and erf neural tangent kernels: We compute the analytic neural tangent kernel corresponding to fully-connected networks with ReLU or erf nonlinearities.,Wide Neural Networks of Any Depth Evolve asLinear Models Under Gradient Descent,http://papers.nips.cc/paper/9063-wide-neural-networks-of-any-depth-evolve-as-linear-models-under-gradient-descent.pdf
2875,intro,['Facilitating use (e.g. sharing code)'],Example code investigating both ... linearizedlearning dynamics described in this work is released as open source code within [15].2We alsoprovide accompanying interactive Colab notebooks for both,Wide Neural Networks of Any Depth Evolve asLinear Models Under Gradient Descent,http://papers.nips.cc/paper/9063-wide-neural-networks-of-any-depth-evolve-as-linear-models-under-gradient-descent.pdf
2876,intro,['Facilitating use (e.g. sharing code)'],We also provide accompanying interactive Colab notebooks for both and linearization.,Wide Neural Networks of Any Depth Evolve asLinear Models Under Gradient Descent,http://papers.nips.cc/paper/9063-wide-neural-networks-of-any-depth-evolve-as-linear-models-under-gradient-descent.pdf
