quote_id,section,labels,quotation,title,url
1855,Introduction,['Applies to real world'],"Restricted Boltzmann Machines (RBMs) (Smolensky,
1986) are generative models based on latent (usually
binary) variables to model an input distribution, and
have seen their applicability grow to a large variety
of problems and settings in the past few years.",Classification using Discriminative Restricted Boltzmann Machines,http://icml2008.cs.helsinki.fi/papers/601.pdf
1856,Introduction,['Flexibility/Extensibility'],"From
binary inputs, they have been extended to model various types of input distributions (Welling et al., 2005;
Hinton et al., 2006). ",Classification using Discriminative Restricted Boltzmann Machines,http://icml2008.cs.helsinki.fi/papers/601.pdf
1858,Introduction,['Successful'],"RBMs have been particularly successful in classification problems either as feature extractors for text and image data (Gehler et al., 2006) or as a good initial
training phase for deep neural network classifiers (Hinton, 2007).",Classification using Discriminative Restricted Boltzmann Machines,http://icml2008.cs.helsinki.fi/papers/601.pdf
1860,Introduction,"['Theoretical guarantees', 'Useful']","When
trained in an unsupervised fashion, RBMs provide no
guarantees that the features implemented by their hidden layer will ultimately be useful for the supervised
task that needs to be solved.",Classification using Discriminative Restricted Boltzmann Machines,http://icml2008.cs.helsinki.fi/papers/601.pdf
1867,Introduction,['Scales up'],"Finally, the algorithms investigated in
this paper are well suited for online learning on large
datasets.",Classification using Discriminative Restricted Boltzmann Machines,http://icml2008.cs.helsinki.fi/papers/601.pdf
1868,Conclusion,['Flexibility/Extensibility'],"We argued that RBMs can and should be used as
stand-alone non-linear classifiers alongside other standard and more popular classifiers, instead of merely
being considered as simple feature extractors.",Classification using Discriminative Restricted Boltzmann Machines,http://icml2008.cs.helsinki.fi/papers/601.pdf
1869,Conclusion,['Quantitative evidence (e.g. experiments)'],We evaluated different training objectives that are more appropriate to train an RBM in a classification setting.,Classification using Discriminative Restricted Boltzmann Machines,http://icml2008.cs.helsinki.fi/papers/601.pdf
1870,Conclusion,['Simplicity'],"These discriminative versions of RBMs integrate the
process of discovering features of inputs with their use
in classification, without relying on a separate classi-fier. ",Classification using Discriminative Restricted Boltzmann Machines,http://icml2008.cs.helsinki.fi/papers/601.pdf
1872,Conclusion,['Scales up'],"We also
presented a novel but straightforward semi-supervised
learning algorithm for RBMs and demonstrated its
usefulness for complex or high dimensional data.",Classification using Discriminative Restricted Boltzmann Machines,http://icml2008.cs.helsinki.fi/papers/601.pdf
1873,Conclusion,['Flexibility/Extensibility'],"For future work, we would like to investigate the use
of discriminative versions of RBMs in more challenging settings such as in multi-task or structured output problems.",Classification using Discriminative Restricted Boltzmann Machines,http://icml2008.cs.helsinki.fi/papers/601.pdf
1875,Conclusion,['Approximation'],"Exact computation of the conditional distribution for the target is not tractable anymore, but there exists promising techniques such as mean-field approximations that
could estimate that distribution.",Classification using Discriminative Restricted Boltzmann Machines,http://icml2008.cs.helsinki.fi/papers/601.pdf
1877,Conclusion,['Efficiency'],"Motivated by this observation, we intend to explore
ways to introduce generative learning in RBMs and
HDRBMs which would be less computationally expensive when the input vectors are large but sparse.",Classification using Discriminative Restricted Boltzmann Machines,http://icml2008.cs.helsinki.fi/papers/601.pdf
1881,Abstract,['Unifying ideas or integrating components'],"Previous methods on the problem typically adopt an inconsistent strategy:
feature extraction is performed in the Euclidean space while non-Euclidean distances
are used.","Grassmann Discriminant Analysis:
a Unifying View on Subspace-Based Learning",http://icml2008.cs.helsinki.fi/papers/312.pdf
1882,Abstract,['Unifying ideas or integrating components'],"In our approach, we treat each subspace as a point in the Grassmann space, and perform feature extraction and classification in the same space.","Grassmann Discriminant Analysis:
a Unifying View on Subspace-Based Learning",http://icml2008.cs.helsinki.fi/papers/312.pdf
1884,Abstract,"['Performance', 'State-of-the-art']","Experiments with
real image databases show that the proposed
method performs well compared with stateof-the-art algorithms.","Grassmann Discriminant Analysis:
a Unifying View on Subspace-Based Learning",http://icml2008.cs.helsinki.fi/papers/312.pdf
1886,Introduction,['Robustness'],"Suppose we want to recognize a person from
multiple pictures of the individual, taken from different angles, under different illumination or at different
places.","Grassmann Discriminant Analysis:
a Unifying View on Subspace-Based Learning",http://icml2008.cs.helsinki.fi/papers/312.pdf
1888,Introduction,['Approximation'],"In this paper, we specifically focus on those data that
can be modeled as a collection of linear subspaces. In
the example above, let’s assume that the set of images
of a single person is well approximated by a low dimensional subspace (Turk & Pentland, 1991), and the
whole data is the collection of such subspaces.","Grassmann Discriminant Analysis:
a Unifying View on Subspace-Based Learning",http://icml2008.cs.helsinki.fi/papers/312.pdf
1889,Introduction,"['Robustness', 'Efficiency']","The
benefits of using subspaces are two-fold: 1) comparing two subspaces is cheaper than comparing two sets
directly when those sets are very large, and 2) it is
more robust to missing data since the subspace can
‘fill-in’ the missing pictures.","Grassmann Discriminant Analysis:
a Unifying View on Subspace-Based Learning",http://icml2008.cs.helsinki.fi/papers/312.pdf
1892,Introduction,['Formal description/analysis'],"With this unifying framework we can
make analytic comparisons of the various distances of
subspaces.","Grassmann Discriminant Analysis:
a Unifying View on Subspace-Based Learning",http://icml2008.cs.helsinki.fi/papers/312.pdf
1894,Introduction,['Unifying ideas or integrating components'],"The Grassmann kernels allow us to use the
usual kernel-based algorithms on this unconventional
space and to avoid ad hoc approaches to the problem.","Grassmann Discriminant Analysis:
a Unifying View on Subspace-Based Learning",http://icml2008.cs.helsinki.fi/papers/312.pdf
1895,Introduction,"['Quantitative evidence (e.g. experiments)', 'Applies to real world']","We demonstrate the proposed framework by using the
Projection metric and the Binet-Cauchy metric and by
applying kernel Linear Discriminant Analysis to classification problems with real image databases.","Grassmann Discriminant Analysis:
a Unifying View on Subspace-Based Learning",http://icml2008.cs.helsinki.fi/papers/312.pdf
1897,Introduction,['Formal description/analysis'],"In this work, we
provide an analytic exposition of the two metrics as
examples of the Grassmann kernels, and contrast the two metrics with other metrics used in the literature.","Grassmann Discriminant Analysis:
a Unifying View on Subspace-Based Learning",http://icml2008.cs.helsinki.fi/papers/312.pdf
1899,Introduction,['Unifying ideas or integrating components'],"However, these methods adopt an inconsistent
strategy: feature extraction is performed in the Euclidean space when non-Euclidean distances are used.","Grassmann Discriminant Analysis:
a Unifying View on Subspace-Based Learning",http://icml2008.cs.helsinki.fi/papers/312.pdf
1900,Introduction,"['Simplicity', 'Theoretical guarantees']","This inconsistency can result in complications and
weak guarantees.","Grassmann Discriminant Analysis:
a Unifying View on Subspace-Based Learning",http://icml2008.cs.helsinki.fi/papers/312.pdf
1901,Introduction,"['Simplicity', 'Theoretical guarantees']","In our approach, the feature extraction and the distance measurement are integrated
around the Grassmann kernel, resulting in a simpler
and better-understood formulation.","Grassmann Discriminant Analysis:
a Unifying View on Subspace-Based Learning",http://icml2008.cs.helsinki.fi/papers/312.pdf
1905,Introduction,"['Quantitative evidence (e.g. experiments)', 'Applies to real world']","In Sec. 6 we test the proposed algorithm for
face recognition and object categorization tasks.","Grassmann Discriminant Analysis:
a Unifying View on Subspace-Based Learning",http://icml2008.cs.helsinki.fi/papers/312.pdf
1909,Conclusion,"['Formal description/analysis', 'Theoretical guarantees', 'Performance', 'State-of-the-art', 'Applies to real world']"," In addition to having
theoretically sound grounds, the proposed method also
outperformed state-of-the-art methods in two experiments with real data. ","Grassmann Discriminant Analysis:
a Unifying View on Subspace-Based Learning",http://icml2008.cs.helsinki.fi/papers/312.pdf
1910,Conclusion,['Understanding (for researchers)'],"As a future work, we are pursuing a better understanding of probabilistic distributions on the Grassmann manifold.","Grassmann Discriminant Analysis:
a Unifying View on Subspace-Based Learning",http://icml2008.cs.helsinki.fi/papers/312.pdf
1911,abstract,['Generality'],Clustering data in high dimensions is believed to be a hard problem in general. ,Multi-View Clustering via Canonical Correlation Analysis,https://dl.acm.org/doi/pdf/10.1145/1553374.1553391?casa_token=aNz0Wqwm8E0AAAAA:MdMCPQZZnRpr3523PDE07KVNiF-i8o4zuykkMjVmzRarLahr-ABLH689DHsMcJuBBzJLzPzLntT_5Q
1912,abstract,"['Efficiency', 'Building on recent work']","A number of efficient clustering algorithms developed in recent years address this problem by projecting the data into a lowerdimensional subspace, e.g. via Principal Components Analysis (PCA) or random projections, before clustering. ",Multi-View Clustering via Canonical Correlation Analysis,https://dl.acm.org/doi/pdf/10.1145/1553374.1553391?casa_token=aNz0Wqwm8E0AAAAA:MdMCPQZZnRpr3523PDE07KVNiF-i8o4zuykkMjVmzRarLahr-ABLH689DHsMcJuBBzJLzPzLntT_5Q
1914,abstract,['Successful'],"Under the assumption that the views are uncorrelated given the cluster label, we show that the separation conditions required for the algorithm to be successful are significantly weaker than prior results in the literature. ",Multi-View Clustering via Canonical Correlation Analysis,https://dl.acm.org/doi/pdf/10.1145/1553374.1553391?casa_token=aNz0Wqwm8E0AAAAA:MdMCPQZZnRpr3523PDE07KVNiF-i8o4zuykkMjVmzRarLahr-ABLH689DHsMcJuBBzJLzPzLntT_5Q
1915,abstract,['Quantitative evidence (e.g. experiments)'],We provide results for mixtures of Gaussians and mixtures of log concave distributions. ,Multi-View Clustering via Canonical Correlation Analysis,https://dl.acm.org/doi/pdf/10.1145/1553374.1553391?casa_token=aNz0Wqwm8E0AAAAA:MdMCPQZZnRpr3523PDE07KVNiF-i8o4zuykkMjVmzRarLahr-ABLH689DHsMcJuBBzJLzPzLntT_5Q
1916,abstract,['Quantitative evidence (e.g. experiments)'],We also provide empirical support from audio-visual speaker clustering (where we desire the clusters to correspond to speaker ID) and from hierarchical Wikipedia document clustering (where one view is the words in the document and the other is the link structure).,Multi-View Clustering via Canonical Correlation Analysis,https://dl.acm.org/doi/pdf/10.1145/1553374.1553391?casa_token=aNz0Wqwm8E0AAAAA:MdMCPQZZnRpr3523PDE07KVNiF-i8o4zuykkMjVmzRarLahr-ABLH689DHsMcJuBBzJLzPzLntT_5Q
1917,introduction ,['Flexibility/Extensibility'],"The multi-view approach to learning is one in which we have ‘views’ of the data (sometimes in a rather abstract sense) and the goal is to use the relationship between these views to alleviate the difficulty of a learning problem of interest (Blum & Mitchell, 1998; Kakade & Foster, 2007; Ando & Zhang, 2007). ",Multi-View Clustering via Canonical Correlation Analysis,https://dl.acm.org/doi/pdf/10.1145/1553374.1553391?casa_token=aNz0Wqwm8E0AAAAA:MdMCPQZZnRpr3523PDE07KVNiF-i8o4zuykkMjVmzRarLahr-ABLH689DHsMcJuBBzJLzPzLntT_5Q
1919,introduction ,['Understanding (for researchers)'],Much recent work has been done on understanding under what conditions we can learn a mixture model.,Multi-View Clustering via Canonical Correlation Analysis,https://dl.acm.org/doi/pdf/10.1145/1553374.1553391?casa_token=aNz0Wqwm8E0AAAAA:MdMCPQZZnRpr3523PDE07KVNiF-i8o4zuykkMjVmzRarLahr-ABLH689DHsMcJuBBzJLzPzLntT_5Q
1921,introduction ,['Easy to work with'],"Under no restrictions on the underlying mixture, this problem is considered to be hard. ",Multi-View Clustering via Canonical Correlation Analysis,https://dl.acm.org/doi/pdf/10.1145/1553374.1553391?casa_token=aNz0Wqwm8E0AAAAA:MdMCPQZZnRpr3523PDE07KVNiF-i8o4zuykkMjVmzRarLahr-ABLH689DHsMcJuBBzJLzPzLntT_5Q
1923,introduction ,"['Efficiency', 'Building on recent work']","In fact, the focus of recent clustering algorithms (Dasgupta, 1999; Vempala & Wang, 2002; Achlioptas & McSherry, 2005; Brubaker & Vempala, 2008) is on efficiently learning with as little separation as possible. ",Multi-View Clustering via Canonical Correlation Analysis,https://dl.acm.org/doi/pdf/10.1145/1553374.1553391?casa_token=aNz0Wqwm8E0AAAAA:MdMCPQZZnRpr3523PDE07KVNiF-i8o4zuykkMjVmzRarLahr-ABLH689DHsMcJuBBzJLzPzLntT_5Q
1926,introduction ,['Applies to real world'],"There are many natural applications for which this assumption applies. For example, we can consider multi-modal views, with one view being a video stream and the other an audio stream, of a speaker — here, conditioned on the speaker identity and maybe the phoneme (both of which could label the generating cluster), the views may be uncorrelated. ",Multi-View Clustering via Canonical Correlation Analysis,https://dl.acm.org/doi/pdf/10.1145/1553374.1553391?casa_token=aNz0Wqwm8E0AAAAA:MdMCPQZZnRpr3523PDE07KVNiF-i8o4zuykkMjVmzRarLahr-ABLH689DHsMcJuBBzJLzPzLntT_5Q
1927,introduction ,"['Quantitative evidence (e.g. experiments)', 'Qualitative evidence (e.g. examples)']","A second example is the words and link structure in a document from a corpus such as Wikipedia – here, conditioned on the category of each document, the words in it and its link structure may be uncorrelated. In this paper, we provide experiments for both settings.",Multi-View Clustering via Canonical Correlation Analysis,https://dl.acm.org/doi/pdf/10.1145/1553374.1553391?casa_token=aNz0Wqwm8E0AAAAA:MdMCPQZZnRpr3523PDE07KVNiF-i8o4zuykkMjVmzRarLahr-ABLH689DHsMcJuBBzJLzPzLntT_5Q
1928,introduction ,"['Simplicity', 'Efficiency']","Under this multi-view assumption, we provide a simple and efficient subspace learning method, based on Canonical Correlation Analysis (CCA). ",Multi-View Clustering via Canonical Correlation Analysis,https://dl.acm.org/doi/pdf/10.1145/1553374.1553391?casa_token=aNz0Wqwm8E0AAAAA:MdMCPQZZnRpr3523PDE07KVNiF-i8o4zuykkMjVmzRarLahr-ABLH689DHsMcJuBBzJLzPzLntT_5Q
1930,introduction ,['Approximation'],"The intuitive reason for this is that under our multi-view assumption, we are able to (approximately) find the low-dimensional subspace spanned by the means of the component distributions. ",Multi-View Clustering via Canonical Correlation Analysis,https://dl.acm.org/doi/pdf/10.1145/1553374.1553391?casa_token=aNz0Wqwm8E0AAAAA:MdMCPQZZnRpr3523PDE07KVNiF-i8o4zuykkMjVmzRarLahr-ABLH689DHsMcJuBBzJLzPzLntT_5Q
1931,introduction ,['Important'],"This subspace is important, because, when projected onto this subspace, the means of the distributions are well-separated, yet the typical distance between points from the same distribution is smaller than in the original space. ",Multi-View Clustering via Canonical Correlation Analysis,https://dl.acm.org/doi/pdf/10.1145/1553374.1553391?casa_token=aNz0Wqwm8E0AAAAA:MdMCPQZZnRpr3523PDE07KVNiF-i8o4zuykkMjVmzRarLahr-ABLH689DHsMcJuBBzJLzPzLntT_5Q
1932,introduction ,['Scales up'],"The number of samples we require to cluster correctly scales as O(d), where d is the ambient dimension. ",Multi-View Clustering via Canonical Correlation Analysis,https://dl.acm.org/doi/pdf/10.1145/1553374.1553391?casa_token=aNz0Wqwm8E0AAAAA:MdMCPQZZnRpr3523PDE07KVNiF-i8o4zuykkMjVmzRarLahr-ABLH689DHsMcJuBBzJLzPzLntT_5Q
1933,introduction ,"['Quantitative evidence (e.g. experiments)', 'Performance']","Finally, we show through experiments that CCA-based algorithms consistently provide better performance than standard PCA-based clustering methods when applied to datasets in the two quite different domains of audiovisual speaker clustering and hierarchical Wikipedia document clustering by category.",Multi-View Clustering via Canonical Correlation Analysis,https://dl.acm.org/doi/pdf/10.1145/1553374.1553391?casa_token=aNz0Wqwm8E0AAAAA:MdMCPQZZnRpr3523PDE07KVNiF-i8o4zuykkMjVmzRarLahr-ABLH689DHsMcJuBBzJLzPzLntT_5Q
1935,Related Work,"['Simplicity', 'Efficiency']",Related Work. Most provably efficient clustering algorithms first project the data down to some lowdimensional space and then cluster the data in this lower dimensional space (an algorithm such as single linkage usually suffices here). ,Multi-View Clustering via Canonical Correlation Analysis,https://dl.acm.org/doi/pdf/10.1145/1553374.1553391?casa_token=aNz0Wqwm8E0AAAAA:MdMCPQZZnRpr3523PDE07KVNiF-i8o4zuykkMjVmzRarLahr-ABLH689DHsMcJuBBzJLzPzLntT_5Q
1937,Related Work,"['Efficiency', 'Building on recent work', 'Improvement']","One of the first provably efficient algorithms for learning mixture models is due to (Dasgupta, 1999), who learns a mixture of spherical Gaussians by randomly projecting the mixture onto a low-dimensional subspace. (Vempala & Wang, 2002) provide an algorithm with an improved separation requirement that learns a mixture of k spherical Gaussians, by projecting the mixture down to the k-dimensional subspace of highest variance.",Multi-View Clustering via Canonical Correlation Analysis,https://dl.acm.org/doi/pdf/10.1145/1553374.1553391?casa_token=aNz0Wqwm8E0AAAAA:MdMCPQZZnRpr3523PDE07KVNiF-i8o4zuykkMjVmzRarLahr-ABLH689DHsMcJuBBzJLzPzLntT_5Q
1938,Related Work,['Building on recent work'],"(Kannan et al., 2005; Achlioptas & McSherry, 2005) extend this result to mixtures of general Gaussians; however, they require a separation proportional to the maximum directional standard deviation of any mixture component. (Chaudhuri & Rao, 2008) use a canonical correlations-based algorithm to learn mixtures of axis aligned Gaussians with a separation proportional to σ* , the maximum directional standard deviation in the subspace containing the means of the distributions. ",Multi-View Clustering via Canonical Correlation Analysis,https://dl.acm.org/doi/pdf/10.1145/1553374.1553391?casa_token=aNz0Wqwm8E0AAAAA:MdMCPQZZnRpr3523PDE07KVNiF-i8o4zuykkMjVmzRarLahr-ABLH689DHsMcJuBBzJLzPzLntT_5Q
1939,Related Work,['Building on recent work'],"Their algorithm requires a coordinateindependence property, and an additional “spreading” condition. None of these algorithms are affine invariant.",Multi-View Clustering via Canonical Correlation Analysis,https://dl.acm.org/doi/pdf/10.1145/1553374.1553391?casa_token=aNz0Wqwm8E0AAAAA:MdMCPQZZnRpr3523PDE07KVNiF-i8o4zuykkMjVmzRarLahr-ABLH689DHsMcJuBBzJLzPzLntT_5Q
1940,Related Work,"['Generality', 'Building on recent work']","Finally, (Brubaker & Vempala, 2008) provide an affineinvariant algorithm for learning mixtures of general Gaussians, so long as the mixture has a suitably low Fisher coefficient when in isotropic position. ",Multi-View Clustering via Canonical Correlation Analysis,https://dl.acm.org/doi/pdf/10.1145/1553374.1553391?casa_token=aNz0Wqwm8E0AAAAA:MdMCPQZZnRpr3523PDE07KVNiF-i8o4zuykkMjVmzRarLahr-ABLH689DHsMcJuBBzJLzPzLntT_5Q
1941,Related Work,['Building on recent work'],"However, their separation involves a large polynomial dependence on 1 wmin. The two results most closely related to ours are the work of (Vempala & Wang, 2002) and (Chaudhuri & Rao, 2008). (Vempala & Wang, 2002) show that it is sufficient to find the subspace spanned by the means of the distributions in the mixture for effective clustering. ",Multi-View Clustering via Canonical Correlation Analysis,https://dl.acm.org/doi/pdf/10.1145/1553374.1553391?casa_token=aNz0Wqwm8E0AAAAA:MdMCPQZZnRpr3523PDE07KVNiF-i8o4zuykkMjVmzRarLahr-ABLH689DHsMcJuBBzJLzPzLntT_5Q
1944,Related Work,['Building on recent work'],"We borrow techniques from both of these papers. (Blaschko & Lampert, 2008) propose a similar algorithm for multi-view clustering, in which data is projected onto the top directions obtained by kernel CCA across the views. ",Multi-View Clustering via Canonical Correlation Analysis,https://dl.acm.org/doi/pdf/10.1145/1553374.1553391?casa_token=aNz0Wqwm8E0AAAAA:MdMCPQZZnRpr3523PDE07KVNiF-i8o4zuykkMjVmzRarLahr-ABLH689DHsMcJuBBzJLzPzLntT_5Q
1945,Related Work,"['Quantitative evidence (e.g. experiments)', 'Performance']","They show empirically that for clustering images using the associated text as a second view (where the target clustering is a human-defined category), CCA-based clustering methods out-perform PCA-based algorithms.",Multi-View Clustering via Canonical Correlation Analysis,https://dl.acm.org/doi/pdf/10.1145/1553374.1553391?casa_token=aNz0Wqwm8E0AAAAA:MdMCPQZZnRpr3523PDE07KVNiF-i8o4zuykkMjVmzRarLahr-ABLH689DHsMcJuBBzJLzPzLntT_5Q
1946,This Work,['Formal description/analysis'],"This Work. Our input is data on a fixed set of objects from two views, where View j is assumed to be generated by a mixture of k Gaussians (D j 1 , . . . , Dj k ), for j = 1, 2. To generate a sample, a source i is picked with probability wi, and x) and x(2) in Views 1 and 2are drawn from distributions D1 and D2.",Multi-View Clustering via Canonical Correlation Analysis,https://dl.acm.org/doi/pdf/10.1145/1553374.1553391?casa_token=aNz0Wqwm8E0AAAAA:MdMCPQZZnRpr3523PDE07KVNiF-i8o4zuykkMjVmzRarLahr-ABLH689DHsMcJuBBzJLzPzLntT_5Q
1947,This Work,['Building on classic work'],"Followin prior theoretical work, our goal is to show that our algorithm recovers the correct clustering, provided th input mixture obeys certain conditons. We impose two requirements on these mixtures. ",Multi-View Clustering via Canonical Correlation Analysis,https://dl.acm.org/doi/pdf/10.1145/1553374.1553391?casa_token=aNz0Wqwm8E0AAAAA:MdMCPQZZnRpr3523PDE07KVNiF-i8o4zuykkMjVmzRarLahr-ABLH689DHsMcJuBBzJLzPzLntT_5Q
1949,This Work,['Generality'],"Moreover, this condition allows the distributions in the mixture within each view to be completely general, so long as they are uncorrelated across views. ",Multi-View Clustering via Canonical Correlation Analysis,https://dl.acm.org/doi/pdf/10.1145/1553374.1553391?casa_token=aNz0Wqwm8E0AAAAA:MdMCPQZZnRpr3523PDE07KVNiF-i8o4zuykkMjVmzRarLahr-ABLH689DHsMcJuBBzJLzPzLntT_5Q
1950,This Work,['Robustness'],"Although we do not prove this, our algorithm seems robust to small deviations from this assumption. Second, we require the rank of the CCA matrix across the views to be at least k − 1, when each view is in isotropic position, and the k − 1-th singular value of this matrix to be at least λmin. ",Multi-View Clustering via Canonical Correlation Analysis,https://dl.acm.org/doi/pdf/10.1145/1553374.1553391?casa_token=aNz0Wqwm8E0AAAAA:MdMCPQZZnRpr3523PDE07KVNiF-i8o4zuykkMjVmzRarLahr-ABLH689DHsMcJuBBzJLzPzLntT_5Q
1953,This Work,['Large scale'],"Here µ 1 i is the mean of the i-th component in View 1 and σ ∗ is the maximum directional standard deviation in the subspace containing the means in View 1. Moreover, the number of samples required to learn this mixture grows (almost) linearly with d.",Multi-View Clustering via Canonical Correlation Analysis,https://dl.acm.org/doi/pdf/10.1145/1553374.1553391?casa_token=aNz0Wqwm8E0AAAAA:MdMCPQZZnRpr3523PDE07KVNiF-i8o4zuykkMjVmzRarLahr-ABLH689DHsMcJuBBzJLzPzLntT_5Q
1956,This Work,"['Building on recent work', 'Improvement']","To get our improved sample complexity bounds, we use a result due to (Rudelson & Vershynin, 2007) which may be of independent interest.",Multi-View Clustering via Canonical Correlation Analysis,https://dl.acm.org/doi/pdf/10.1145/1553374.1553391?casa_token=aNz0Wqwm8E0AAAAA:MdMCPQZZnRpr3523PDE07KVNiF-i8o4zuykkMjVmzRarLahr-ABLH689DHsMcJuBBzJLzPzLntT_5Q
1957,This Work,['Improvement'],We stress that our improved results are really due to the multi-view condition. ,Multi-View Clustering via Canonical Correlation Analysis,https://dl.acm.org/doi/pdf/10.1145/1553374.1553391?casa_token=aNz0Wqwm8E0AAAAA:MdMCPQZZnRpr3523PDE07KVNiF-i8o4zuykkMjVmzRarLahr-ABLH689DHsMcJuBBzJLzPzLntT_5Q
1958,This Work,['Simplicity'],"Had we simply combined the data from both views, and applied previous algorithms on the combined data, we could not have obtained our guarantees. ",Multi-View Clustering via Canonical Correlation Analysis,https://dl.acm.org/doi/pdf/10.1145/1553374.1553391?casa_token=aNz0Wqwm8E0AAAAA:MdMCPQZZnRpr3523PDE07KVNiF-i8o4zuykkMjVmzRarLahr-ABLH689DHsMcJuBBzJLzPzLntT_5Q
1959,This Work,['Successful'],"We also emphasize that for our algorithm to cluster successfully, it is sufficient for the distributions in the mixture to obey the separation condition in one view, so long as the multi-view and rank conditions are obeyed.",Multi-View Clustering via Canonical Correlation Analysis,https://dl.acm.org/doi/pdf/10.1145/1553374.1553391?casa_token=aNz0Wqwm8E0AAAAA:MdMCPQZZnRpr3523PDE07KVNiF-i8o4zuykkMjVmzRarLahr-ABLH689DHsMcJuBBzJLzPzLntT_5Q
